ID,Aggregate number,Module title,Member genes
M3.1,A29,Cell cycle,"ALPP, ALS2CR14, ANKRD30B, ARL16, BCYRN1, BLZF1, BLZF1, C11ORF63, C1ORF176, C5ORF28, C6ORF170, C8ORF45, C9ORF130, CCBE1, CEP27, CSF2RA, CYCSL1, DCLRE1C, DDX51, DENR, DMC1, DTWD2, DUXAP3, EIF2AK4, EVI5, FAM40B, FAM73A, FLJ38717, FLJ40722, FLJ44124, GALNT3, GPR1, GSTTP2, HNRNPU, HS.163752, HS.542993, HS.562875, HS.571741, HS.576072, HSPC268, HYPK, ICA1, IL10, IL17RD, KIAA1751, LEP, LMOD3, LOC123688, LOC440157, LOC643882, LOC644250, LOC644852, LOC648852, LOC653829, LSDP5, MAGT1, MBTD1, MCART1, MCM8, MYO3B, N4BP2, NLRP8, NUBPL, OCIAD1, PCDHB19P, PCDHB9, PIP5K2B, PLA2G2D, PLDN, POLR2J4, PPA2, PPM1K, PRO1853, PTP4A2, PTP4A2, PTPLAD2, RAXL1, RHBDL2, RNUXA, SLC25A20, SLC35E1, SLC4A5, SLC5A8, SNAPC1, SPTLC1, SSTR2, SYAP1, TDP1, TDRD1, TDRD1, TNFSF15, TRIM13, USP49, VPS41, WDR74, XRCC2, YRDC, ZADH1, ZNF14, ZNF223, ZNF483, ZNF486, ZNF557, ZNF577, ZNF652, ZNF669, ZNF682, ZNF69, ZNF786"
M8.1,A29,TBD,"AHR, AIRE, BIRC3, C14ORF85, C21ORF24, C21ORF55, C3ORF34, C8ORF37, C9ORF80, CDAN1, CDKN2AIPNL, CREB1, CREB1, EID2B, FAM115A, FAM119A, FCAR, FKTN, FLJ46309, GJC1, GRIPAP1, HCG2P7, IL18, KCNH6, LILRB1, LOC399900, LOC440704, LOC441087, LOC642947, LOC645895, LOC647389, LOC653086, LOC653489, LOC729603, LOC90586, LRAP, MBD4, MGC29891, PDE4C, PNPT1, RCP9, RPL7L1, SDHALP1, SHROOM4, SLC16A12, SLC44A4, SULT1A1, TMEM17, ZMAT3, ZNF394, ZNF430, ZNF549"
M8.2,A34,Prostanoids,"ABCC3, ABLIM3, ALOX12, AQP10, C6ORF21, C7ORF41, CALD1, CMTM5, CTDSPL, CTTN, ESAM, F13A1, GNG11, GP9, GUCY1A3, HS.552264, ITGA2B, ITGB3, ITGB5, ITGB5, JAM3, MPL, MYL9, NRGN, PARVB, PDE5A, PPBP, PROS1, PTGS1, PVALB, SEPT5, SH3BGRL2, TNFSF4, TREML1, TSPAN33, TSPAN9, VWF"
M8.3,A28,Type 1 Interferon,"EPSTI1, HERC5, HES4, IFI44, IFI44L, IFI6, IFIT1, IFIT3, IFIT3, IFIT3, ISG15, LY6E, MX1, OAS1, OAS1, OAS2, OAS3, OASL, RSAD2, XAF1, XAF1"
M9.1,A2,Cytotoxic lymphocytes,"CCL4L2, CD160, CLIC3, EDG8, EOMES, FGFBP2, GNLY, GNLY, GPR56, GPR56, GZMA, GZMB, GZMH, HOPX, IL2RB, KIR2DL3, KIR2DL4, KIR3DL1, KLRC1, KLRC3, KLRD1, KLRD1, KLRF1, KLRF1, NKG7, PLEKHF1, PPP2R2B, PRF1, PTGDR, SH2D1B, TGFBR3, ZNF683"
M9.2,A37,Erythrocytes,"MARCH8, ALAS2, ALAS2, BCL2L1, BPGM, C14ORF45, C1ORF128, CA1, EPB42, FAM46C, FECH, GMPR, GPR146, GYPB, GYPE, IFIT1L, KRT1, NFIX, OR2W3, OSBP2, PLEK2, SELENBP1, SLC14A1, SLC4A1, SNCA, TMCC2, TMOD1, TNS1, TRIM10, TUBB2A, XK"
M10.1,A28,Interferon,"DDX58, DDX60, DHX58, FBXO6, GBP1, GBP1, GBP4, GBP5, IFI35, IFIH1, IFIT2, IFIT5, IRF7, IRF7, LAP3, OAS2, PARP12, PARP14, SAMD9L, SCO2, STAT1, STAT1, STAT1, TRIM22, ZBP1"
M10.2,A9,Protein synthesis,"C19ORF31, CLUAP1, EEF1A1, F2R, FTL, H3F3A, HBA2, HBB, IMAA, LAIR1, LOC388720, OAZ1, RPL41, RPS12, RPS27, TMSB4X, TPT1, UBA52, UBB"
M10.3,A34,Platelet,"ACRBP, BMP6, CDC14B, CLDN5, CLEC1B, DAB2, FHL1, GP1BA, GRAP2, HS.25318, MMD, NAT8B, PGRMC1, PTCRA, RUFY1, RUFY1, SDPR, TSC22D1, TSC22D1, TUBB1, VCL, ZNF185"
M10.4,A38,Neutrophil activation,"BPI, CEACAM6, CEACAM8, CTSG, DEFA1, DEFA3, DEFA4, ELA2, LOC653600, LOC728358, LOC728358, LOC728358, LTF, MPO, OLFM4"
M11.1,A1,Protein synthesis,"EEF1B2, EEF2, LOC388524, LOC440589, LOC441246, LOC441876, LOC642250, LOC643433, LOC644029, LOC645683, LOC645899, LOC646195, LOC646200, LOC646483, LOC646766, LOC649150, LOC649447, LOC649821, LOC653232, LOC653314, LOC731096, RPL10A, RPL12, RPL17, RPL17, RPL18, RPL18A, RPL18A, RPL18A, RPL19, RPL27, RPL35, RPL35A, RPL36, RPL4, RPL5, RPL6, RPL8, RPL9, RPLP1, RPS13, RPS14, RPS14, RPS15, RPS17, RPS18, RPS20, RPS27A, RPS3, TOMM7, TOMM7"
M11.2,A37,TBD,"ABCC4, AMFR, BAT3, BMP2K, C17ORF39, C9ORF40, DNAJB2, EIF1B, GDE1, GNA12, HS.211743, HS.57079, IQWD1, JAZF1, MED25, NSUN3, ODC1, POLR1D, PPP2R5B, PSME4, RANBP10, RNF14, RSRC1, SELK, SLC2A1, SNX3, TBC1D22B, TMEM183A, TMEM183B, UBE2F, UBQLN1, WBP2, WDR26, WDR45, WDR51B, WNK1, ZBTB44, ZER1, ZNF653"
M11.3,A37,Erythrocytes,"ASCC2, C18ORF10, C18ORF10, DPM2, EPB49, FBXO7, FBXO7, GATA1, HAGH, HEMGN, HEMGN, HMBS, KEL, LOC284422, LOC440359, LOC441081, MBNL3, MBNL3, MYL4, PDZK1IP1, PHOSPHO1, RUNDC3A, SESN3, TESC, TGM2, TRIM10, TSPAN5, VWCE"
M11.4,A37,TBD,"AP2M1, AP2M1, AP2S1, ATG9A, ATG9A, B4GALT3, BCL2L13, C13ORF15, C19ORF62, CYB5R3, DAP, DENND1A, FAM134A, HK1, JUND, MSI2, NTAN1, NUCB1, PA2G4, POLR1D, TCEB2, UBAC1, UBAP1, UBL7, UROD, WDR13, WIPI2, ZMAT2"
M12.1,A1,Protein modification,"ACAT1, ACTL6A, AHCY, AIFM1, AKAP7, APOBEC3G, ARL5A, BCCIP, BCDIN3D, BMI1, BNIP3, BXDC1, BXDC2, C14ORF112, C16ORF80, C18ORF55, C1ORF19, C3ORF28, C4ORF14, C6ORF125, C6ORF130, CCDC115, CCDC50, CCT2, CNO, COPS4, CSE1L, DCTD, DCUN1D5, DDX19B, DDX21, DIMT1L, DNAJC9, EBNA1BP2, EEF1B2, EEF1E1, EI24, EIF2B1, EMG1, ENOPH1, FAM58A, FBXO21, FH, GART, GEMIN6, GLO1, GTF2H5, HACL1, HADH, HINT2, HNRNPA0, HSPE1, INTS9, JTV1, KIAA1128, KLF9, KRT10, LETMD1, MED10, METTL5, MEX3C, MIS12, MRPL15, MRPL21, MRPL32, MRPL35, MRPL43, MRPL45, MRPL46, MRPS27, MRPS30, MRPS33, NAE1, NAT5, NDUFA9, NIF3L1, NIP7, NXT1, PDCD2, PDCD5, PEPD, PFDN1, PHACTR4, PIGP, PPHLN1, PPHLN1, PRKCQ, PWP1, RAB7L1, RABGGTB, RCN2, RPAIN, RPUSD4, SCO1, SLC25A25, SNRPC, TCEAL4, TFB2M, TGIF1, TH1L, TMEM126A, TMEM203, TMEM4, TOMM20, WDR33, WDR57, WDR61, ZC3HC1, ZCCHC7, ZFP90, ZNF22, ZNF800"
M12.2,A26,Monocytes,"ALDH1A1, ALDH2, ASAHL, ASAHL, ASGR1, ASGR2, ASGR2, C4ORF18, C4ORF18, CARD9, CCR2, CCR2, CD163, CD300C, CD33, CD36, CD36, CD86, CEBPA, CENTA2, CPVL, CPVL, CSF1R, CTSH, CYBB, CYFIP1, CYP1B1, DPYSL2, EDG3, EMILIN2, EPB41L3, FLJ21986, FLVCR2, FZD2, HNMT, IFI30, KIAA1598, KLF4, KYNU, KYNU, LY86, MAFB, MGST1, MS4A6A, MS4A6A, MTMR11, PLA2G7, PLXNB2, RNASE4, SLC7A7, TGFBI, VCAN"
M12.3,A1,Cell cycle,"ABCE1, ABCE1, AGK, AKAP11, AKAP11, ANAPC1, BMS1, C19ORF2, C1ORF181, CCDC6, CDK6, CIRH1A, DIS3L, DNAJA3, DNAJC10, DPH2, ELP3, FAM62B, FBXO31, FLJ20160, FVT1, GARNL1, GFM1, GLOD4, GTPBP4, HS.213061, HS.276860, IARS, KIAA0020, LANCL1, LANCL1, LOC647346, LPAR5, LPIN1, MAP3K4, MBNL2, MKI67IP, NKRF, NOC3L, NOL11, NPAL3, NUP160, NUP205, OGFOD1, ORC5L, PPP1R16B, PRMT6, PRPS1, PTPLB, RASGRP3, RFC1, SEPHS1, SLC4A7, STAMBPL1, STK39, TP53RK, TTC19, TTC4, UBQLN4, UTP14A, WBSCR22, WDR4, WDR54, WDR67, WWP1, XPO4, ZBTB24, ZFP161, ZMYND11, ZNF146, ZNF544, ZNF816A, ZZZ3, ZZZ3"
M12.4,A2,Gene transcription,"AKR7A2, ARHGAP17, ARL2, ASPSCR1, BCKDHA, BRD9, C11ORF2, C14ORF173, C17ORF61, C17ORF70, C19ORF53, C2ORF29, C6ORF153, C7ORF50, CCDC12, CCDC56, CHMP4A, CPSF4, CXXC1, E4F1, EDC4, EMD, ETFB, EXOSC1, FASTK, GPS1, GTPBP6, HARS, HCFC1, IDH3B, LOC339123, MCM7, MRPL22, MRPL37, NDUFA8, NENF, NHP2L1, NT5C, NUDC, PEX16, PLD3, PSMC5, PUF60, QRICH1, RBM14, RCC2, REPIN1, RPP21, SF3A3, SIVA, SMARCA4, SPNS1, SUSD3, TJAP1, TRAPPC2L, TRPT1, TUSC4, TXLNA, UBAC2, VIL2, YARS, ZDHHC16"
M12.5,A3,Protein modification,"ACBD3, ACVR1, AGGF1, ANGEL2, ANKRD49, AP3M1, APPBP2, ARHGEF7, ASB3, ASNSD1, BAG5, BTBD6, C13ORF23, C14ORF135, C14ORF135, C21ORF66, C2ORF64, C4ORF41, C5ORF5, C7ORF26, CABC1, CCDC117, CCDC16, CCDC16, CDC2L5, CHD8, CLK2, CUL2, DDX23, DENR, DERL1, DMTF1, EIF4G1, ERCC5, FAM122B, FLJ10081, FXR1, GMEB2, GNPTG, HEATR5B, HECTD1, HNRNPC, HS.475334, HS.92308, INTS10, KIAA0157, KIAA0196, KIAA0907, KIAA1191, KIAA1370, KIAA1370, KIAA1712, KLHL9, LASS6, LEMD3, LOC285636, LOC400027, MACF1, MKRN2, MRPS10, MSH6, MST4, MTIF2, OMA1, PCM1, POLR2B, PRPSAP1, PUM1, RAB22A, RAB3GAP1, REV1, RPS6KB1, SCFD1, SLC30A7, SLC35E1, SLTM, SMARCC1, SMC3, SRRM1, TAF4, TBP, TFAM, TMEM41B, TNPO2, UBE3C, USP16, USP16, USP24, VPS36, ZBED5, ZFYVE20, ZNF274, ZNF434, ZNF598, ZNF721"
M12.6,A1,T cells,"AXIN2, BCL11B, C10ORF38, CCDC104, CCNB1IP1, CD40LG, CXCR7, D4S234E, FAM102A, FAM84B, FBXO32, FCGBP, GPR18, HS.447508, HS.564504, HS.567464, KLHL3, LRRN3, LRRN3, LY9, MAGEE1, MAN1C1, MGC52498, NELL2, NMT2, NR3C2, PASK, PASK, PLEKHB1, SIDT1, SIRPG, TCEA3, TSEN54, ZNF256, ZNF548"
M12.7,A1,Protein synthesis,"C6ORF48, EEF1B2, EEF1G, EIF3EIP, LOC127295, LOC158345, LOC283345, LOC283412, LOC284821, LOC285053, LOC285900, LOC347292, LOC347544, LOC390354, LOC440737, LOC642989, LOC644029, LOC644511, LOC645688, LOC648622, LOC651436, LOC653232, LOC728481, LOC731985, LOC91561, RPL12, RPL13, RPL13A, RPL17, RPL3, RPS2, RPS4X, RPS4X, RPS5, RTN2, UBA52"
M12.8,A1,B cells,"AFF3, BANK1, BLK, CCR6, CD19, CD72, CD79A, CD79B, CD79B, COBLL1, CXCR5, E2F5, EBF1, FAM129C, FCER2, FCRL2, FCRLA, GNG7, HLA-DOA, HLA-DOB, HS.91389, LOC90925, MS4A1, OSBPL10, TCL1A, TSPAN13, TSPAN13, VPREB3"
M12.9,A38,Protein phosphorylation,"ANP32B, AP2S1, ATP5EP2, BRP44, CARHSP1, CCNI, CHP, CLCN3, CMAS, CMAS, CTSB, CYB5R3, EIF1, EIF4EBP2, ERAL1, FEM1A, GNAS, GPS2, HCCA2, HPCAL1, ISCU, KIAA0430, LOC285074, LOC407835, MAP2K2, PCBP2, PCBP2, PIK3R2, PQLC1, PRDX5, RAB6A, RALBP1, REXO2, RFNG, ST13, STAU1, TBPL1, TRAPPC5, TRIP12, TUBB2C, UBE2D3, UBE2M, VPS28, YY1AP1"
M12.10,A35,Inflammation,"ABTB1, ALOX5, ATG16L2, C10ORF54, CEBPD, CENTD3, CRISPLD2, CXCL16, EDG4, EMR2, FAM53C, FRAT2, GALNAC4S-6ST, IGF2R, IGSF6, IL13RA1, ITGAX, LAMP2, LILRB3, MBD6, MBOAT7, MXD1, MYO1F, NARF, NCF1C, NDEL1, NUMB, PFKFB4, PILRA, RAB24, RAF1, RNF130, RTN3, SIRPA, SKAP2, SLC12A9, SLC25A44, SSH2, STX3, SVIL, TBXAS1, TIMP2, TLR8, TMEM71, TNFRSF1A, TSEN34, TSEN34, UBN1, ULK1, ULK1, USP10, XPO6, ZNF467, ZNF746, ZYX"
M12.11,A37,Erythrocytes,"ALDH5A1, ALDH5A1, BNIP3L, BNIP3L, C20ORF108, DNAJA4, FAM104A, HBD, HS.105618, HS.291319, ISCA1L, LOC389293, MPP1, MXI1, PRDX2, PRDX2, RAB2B, RAD23A, RIOK3, RPIA, SIAH2, SLC1A5, TFDP1, TFDP1, TRAK2, TSTA3, UBE2O, YOD1"
M12.12,A25,Oxidative stress,"MARCH1, ADSS, ARL6IP6, ATP5F1, C10ORF78, C3ORF38, CASC4, CDC42SE2, CNBP, CNIH, DC2, FAM18B, FAM18B, FAM18B2, FNTA, GABPA, LOC390466, LOC643357, LOC644762, LOC647349, LOC649555, LOC652489, LOC653226, LYPLA1, PRDX3, PRDX3, PSMA1, PSMD6, SLC25A40, SUMO2, TNFAIP8, TSNAX, UBA3"
M12.13,A24,Oxidative phosphorylation,"ANAPC11, ATP5F1, ATP5H, ATP5I, ATP5J, ATP5J, ATP5J2, C11ORF10, C20ORF52, CHCHD9, CIP29, COX17, COX5B, COX7B, COX8A, ETFA, FAM96A, GTF2A2, GTF2F2, LOC644863, LOC647340, LOC650518, MRPL33, MRPS18C, NOL7, NRAS, PLAC8, PLAC8, POLR2F, POMP, PPP2R5C, PSMA1, PSMA4, PSMA4, PSMA6, PSMA6, PSMB1, RPS27L, SEC61B, SLC35B1, SRP14, SRP54, SRP54, TCEB1, TMCO1, TPI1, TXNDC1, TXNDC17, UBE2E1, UQCRFS1, VPS25, ZNF207"
M12.14,A29,TBD,"C14ORF24, CCR6, DAPP1, FARSLB, FLJ41423, GGA1, ITIH5, LILRB3, LOC389517, LOC643509, MGC16703, MSH3, ORC6L, PDCD7, PDSS2, RN7SL1, ROCK2, SHCBP1, WDR23, ZNF655"
M12.15,A27,Cell cycle,"ABCB9, CCNB2, CD38, CDC20, CDCA5, IGJ, IGLL3, KIAA0101, LOC649923, LOC652775, MGC29506, TNFRSF17, TOP2A, TXNDC5, TXNDC5, TYMS, UBE2C, UBE2C, UHRF1"
M13.1,A35,Inflammation,"ABTB1, ACAA1, ACSS2, AIF1, ANKRD13A, AOAH, APAF1, ARHGAP9, ARID3A, ATP6V0D1, AXUD1, C17ORF62, C20ORF24, C9ORF19, CAB39, CAPZA2, CASP1, CD300A, CD55, CDKN2D, CHMP2A, CKLF, CLEC12A, CLEC12A, CLEC4A, CLEC4A, CNIH4, CSNK1D, CYP4F3, DHRS7, E2F3, EDG6, EHD1, FBXL5, FES, FGR, FKBP1A, FLOT2, FTH1, FTHL11, FTHL3, G6PD, GAPDH, GRN, GRN, HIST1H2BK, HMGB2, HSPA1B, IFNGR1, IL10RB, IMPDH1, IQGAP1, KIAA1949, LAMP2, LAMP2, LAMP2, LILRA2, LMO2, LOC730744, LRP10, LST1, LST1, M6PRBP1, MAPK1, MAPK3, MGC4677, MIDN, MLKL, MS4A6A, MSRB2, MVP, MYD88, NADK, NBEAL2, NCSTN, NFKBIZ, NOLA3, NOTCH1, NRD1, OBFC2A, OSTF1, P2RY13, PACSIN2, PADI4, PARP9, PCNX, PELI1, PELO, PHF21A, PICALM, PLOD1, PPM1M, PPP1R15A, PPP2R5A, PRCP, PRCP, PRKCD, PTEN, PTPN12, PTPRE, PTPRE, PYCARD, RAB24, RAB32, RAB6IP1, RARA, RASSF2, RBMS1, RPS6KA1, RXRA, S100A6, SELL, SFXN4, SIGLEC10, SLA, SLC15A3, SLC15A4, SLC31A2, SLC40A1, SLC9A1, SMAP2, SNX27, STAT3, STAT5B, STX10, SYK, TBC1D14, TBL1X, TCIRG1, TIMP1, TKT, TLN1, TMEM91, TNFRSF1B, TNFSF13B, TOM1, TPD52L2, TPST2, TST, TXN, TXN, USP3, ZFP106, ZFP106, ZFP36, ZMIZ1, ZYX"
M13.2,A1,Gene transcription,"AKR1B1, ALS2CR13, APEX1, APEX1, ARL2BP, ATM, ATM, ATP6V0E2, BCL11A, BIN1, BTN3A2, C12ORF47, C12ORF57, C1QBP, C21ORF33, C5ORF39, C7ORF23, CCND2, CD2, CD47, CLNS1A, CYFIP2, DDX1, DDX18, DDX47, DENND2D, DKC1, DNMT1, DOCK10, EBI2, EEF1D, EIF3F, EIF3M, EPRS, ESD, FBXL10, FNBP4, FOXO1, FYN, GIMAP6, HLA-DQA1, ID2, ILF2, IMP3, ITK, ITM2A, LEPROTL1, LOC124512, LOC439949, LOC728554, LOC730432, LPXN, LSM5, LSM7, MCM3, MDH1, MFNG, MRPL3, MRPS24, MTSS1, MYC, NAP1L1, NCL, NSMCE4A, NUP43, OCIAD2, PABPC4, PCID2, PPIL3, PRKCH, PRKRIR, RFX5, RPAIN, RPL22, RSL1D1, SET, SHMT2, SLC38A1, SNRPA1, SNRPF, SNRPF, ST6GAL1, STARD7, STAT4, TIGA1, TINP1, TOP2B, TRAF3IP3, TTC3, UBE2N, ZMYM6, ZNF22, ZNF302, ZNHIT3, ZRANB2"
M13.3,A35,TBD,"ACSS2, ANKRD33, APH1B, ATF6, ATG7, B9D2, C11ORF56, C14ORF94, C9ORF72, CBARA1, CD82, CENTD2, CFP, CORO1C, CSF2RA, CSF2RA, CTNNA1, CTSD, CUTL1, DDEF1, DIRC2, DJ341D10.1, EDEM2, ELL, ENTPD1, ERO1L, ETS2, ETV6, EXOC6, FAM100B, FAM129B, FBXO38, FERMT3, FKBP5, G6PD, GADD45A, GAS7, GBA, GBA, GBE1, GNA15, GNAI3, GNB2, HDAC4, HIATL1, HK2, HK2, HLX, HMGB2, HSDL2, IER3, IRS2, KBTBD7, KIAA0513, LOC644642, LOC728069, LPGAT1, LRRC25, LRRFIP2, LRRFIP2, LTB4R, MAP3K2, MAPK1, MEGF9, MICAL1, MSRA, MTX1, MVP, NBN, NDRG1, NLRX1, OPRL1, OSBPL8, OSCAR, P2RX1, PDK3, PFKFB3, PGM1, PHCA, PIM3, PLEKHO2, PLP2, PPP1R3D, PRAM1, QSOX1, RILPL2, RNF144B, RRAGD, RRP12, SHKBP1, SIRPA, SLC37A3, SORT1, SQRDL, TACC3, TBC1D2, TEF, THOC5, THOC5, TM6SF1, TMCO3, TMEM120A, WIPI1, YIPF1, YIPF1, ZBTB34"
M13.4,A2,Protein synthesis,"ACTR1B, AK3, AOF2, AP4B1, APOL3, ASNS, ATP8B2, BEXL1, BOP1, C16ORF58, C19ORF12, C1ORF164, C3ORF37, C6ORF192, C8ORF40, C8ORF55, C9ORF114, CARD11, CCDC45, CECR5, COPS7B, CPSF1, CSNK1E, DCXR, DDHD2, DEXI, DGKA, DGKA, DMAP1, DMAP1, DNLZ, ECHS1, EIF2B5, ERCC1, EXOSC8, FAM136A, FN3KRP, GALT, GCN5L2, GPD1L, HAX1, HCST, HS.213541, IL18BP, ILF3, IMP4, ITFG2, KLHL22, LARS, LAT, LCMT1, LETMD1, LOC727820, LOC730256, LSM4, LTA, MAN1B1, MCEE, MEF2D, MRPL11, MRPL11, MRPL41, MRPS18B, MRPS21, MRPS7, MT1X, MTP18, MUTYH, NAT10, NDUFV1, NICN1, NOL1, NOL6, NSMCE1, NUDT1, PAFAH1B3, PCNT, PEX11B, PH-4, PHF15, PMPCA, PNPO, POLR2H, PPIH, PSMD8, PTGES2, PUS1, R3HCC1, RAB11FIP3, RANGAP1, RASSF7, RNF216, RNMTL1, RP9, RPL7L1, RPUSD3, SAMM50, SCAMP3, SCRIB, SF3B3, SLC25A42, SLC41A3, SMAD3, SMCR7L, SRPRB, STRA13, TH1L, TMEM138, TMEM150, TMEM156, TOMM22, TOMM40, TSPAN31, TYSND1, UBE2G2, UCHL5IP, UQCC, WDR18, XAB1, ZC3H5, ZNF266, ZNF342"
M13.5,A32,Cell death,"2-Sep, ADPGK, AKAP13, AMD1, ANAPC13, ANKRD11, AP1G1, AP3B1, ARFGEF1, ARID1A, ARPC1A, ASB8, ASH2L, BANP, BAT2D1, C3ORF19, CASP9, CCDC128, CDC2L6, CHFR, CLP1, CMTM3, COPS7A, COQ10B, CRKL, CTDSP2, CUL4B, DOCK2, DPF2, DSCR3, DUSP22, DYNC1LI2, EIF4G2, ERICH1, FAM120A, FAM120B, FAM131A, FBXO11, FBXO38, GALC, GAPVD1, GATAD2A, GLB1, GNB1, GOLGA5, GPBP1L1, HS.5724, HSBP1, JARID1A, KBTBD2, KCTD5, KIAA0174, KIAA0892, KIAA1219, KLHL12, LAMP1, LARP5, LASS2, LOC387820, LOC400890, LOC644033, LOC650152, LOC728556, MARK3, MEMO1, MKKS, MKLN1, MLSTD2, MTM1, MTMR14, MTRF1L, NBPF11, NCOA6, NECAP1, NUFIP2, NXF1, OXSR1, PAFAH1B1, PARP4, PCF11, PHF2, PHF3, PHKB, PLCG2, PLEKHA2, PPP2R2A, PREI3, PRKAA1, RAB11A, RAE1, RBM25, RCSD1, RIPK1, RNF103, RNF19A, RNF38, SAP130, SCAP, SCLT1, SEMA4D, SENP2, SETD2, SF3B1, SFRS17A, SFRS4, SH3KBP1, SLMAP, SMAD4, SMG1, SPEN, STAMBP, STK38, STS-1, STX6, TACC1, TAX1BP1, TBC1D20, TGOLN2, TLK2, TMEM2, TMEM50A, TRIM39, TUG1, UPF2, USP4, USP9X, VEZF1, VPS4B, WDR1, YWHAZ, ZC3H7A, ZDHHC7, ZFAND5, ZNF586"
M13.6,A1,Gene transcription,"AASDHPPT, ACTR6, ADO, AES, API5, ARMC1, BBS2, BCL2, BTN3A3, BUB3, BUB3, C10ORF104, C10ORF32, C18ORF17, C21ORF57, C9ORF5, CCDC25, CD69, CDC23, CDK4, CDK5RAP1, CNOT7, COPS8, CSTF3, CTSO, CUL5, CXORF26, CYP4V2, DC2, DCK, DPH5, EBAG9, EP400, EXOSC10, EXOSC6, FAM133B, FAM43A, FARS2, FLJ11171, FLJ20718, FOXK1, FUBP3, FYN, G3BP1, GEMIN4, GLS, GRPEL2, IAH1, IARS2, IBTK, KCTD6, KIAA0355, KIAA0372, KIAA0391, KIAA1826, KTN1, LAGE3, LOC203547, LOC402644, LOC644096, LRBA, LYRM2, MAGED1, MCCC1, METAP1, METTL3, MGC12966, MGC3207, MOAP1, MRPL14, MRPL50, MRPL54, MRPS27, MRPS35, MTCP1, MTERFD1, MTO1, NCBP2, NFX1, NGDN, NGDN, NHP2L1, NOP5/NOP58, NPIP, NUDT21, NUP54, NUPL2, P117, PDCD2, PPP1R2, PRKRA, PRMT1, PRMT3, PSIP1, PURA, RABGGTB, RBMX, RDH14, RNMT, RPUSD2, RYK, SDAD1, SERBP1, SFRS7, SIVA, SKIV2L2, SMAD5, SNUPN, SNURF, SNX4, SP4, SUCLA2, SUCLG2, TCEAL8, THUMPD1, TMED10, TMEM160, TMEM203, TMEM209, TMEM42, TMEM50B, UBE3A, UBE3A, UFM1, WDR75, ZFAND1, ZNF621, ZNF627, ZNF689, ZNHIT3"
M13.7,A33,TBD,"ABHD3, ACSL3, AHCTF1, AKAP13, ANXA11, AP3S1, ARFGAP3, ARFIP1, ARHGAP19, ARNTL, ATP2B4, ATP2B4, C14ORF100, C14ORF138, C1ORF119, CAMK1D, CAMK2G, CBL, CCDC49, CCNG2, CDC123, CENTB2, CHMP2B, CHUK, CRK, CRK, DICER1, DIP2B, DNAJB6, DPYD, DUSP18, DYRK1A, DYRK1A, ELMO1, FAM48A, FEM1C, HBP1, HERC4, HNRNPL, IFNAR2, ITFG1, IVNS1ABP, IVNS1ABP, JARID1B, JMJD1B, KIDINS220, KLHL5, KLHL8, LACTB, LASS2, LGALS8, LOC644935, LYST, MANBA, MAP3K8, MAP4K4, ME2, ME2, MIER1, MTMR6, NCOA7, NIPBL, NPEPPS, NUAK2, NUP153, OSBPL9, PAM, PANK2, PAPSS1, PELI2, PHF20L1, PTPN12, PTTG1IP, RFFL, RMI1, RNF135, RNF145, SCYL2, SDF2, SENP6, SERINC1, SLK, SMCHD1, SP3, SPAG9, SPAST, ST8SIA4, STAU1, STX7, STXBP3, TBC1D15, TBK1, TMEM55A, TXNRD1, UGP2, USP15, USP38, VCPIP1, WIPF1, XRN2, ZDHHC17, ZNF143, ZSWIM6"
M13.8,A3,TBD,"AMY2A, ANKRA2, ARGLU1, C6ORF111, CAPRIN2, CCDC14, CCDC84, CROP, CRYZL1, CXORF45, D2HGDH, DIDO1, ENOSF1, FYN, GALK2, GOLGA8B, GSDML, GSDML, GUSBL1, HNRPDL, HS.143408, HS.409512, IL11RA, LOC132241, LOC153561, LOC338799, LOC728565, LOC728888, LOC729559, MZF1, NKTR, NKTR, NSUN5, NSUN5C, OGT, OGT, PDE7A, PLA2G4B, PLCH2, PRPF4B, RBM6, SEPT1, SEPT6, SFRS14, SFRS5, SMA4, SNORA25, SNORA70, STAG3L2, TAF1C, TAGLN, TARDBP, TPM2, TTC13, TTC14, TTC14, VAMP1, WDR33, ZNF83"
M13.9,A3,Gene transcription,"ADAT1, ADNP2, AKAP8, ALG6, ALS2, ANKHD1, ANKRD10, AP4E1, APTX, ARL5A, ATG16L1, ATG16L1, ATP11C, ATP2A2, BFAR, BRPF1, C10ORF137, C10ORF6, C13ORF23, C16ORF56, C5ORF37, CASP2, CBR4, CCDC77, CDC2L5, CEBPG, CEP192, CGGBP1, CHCHD7, CNOT6, CSTF3, CTCF, DDX46, DHFRL1, DHPS, DHX15, DHX33, EHD4, EIF2S3, EPM2AIP1, ERP27, FAM152A, FLJ20323, FNTA, GALNT11, GNPTAB, HNRNPD, HS.126768, HS.19339, HS.294103, HS.538259, HSPA14, KIAA0141, KIAA1191, KIAA1737, KIF13B, KRIT1, LOC400657, LOC650215, MFSD8, MTMR9, MTRR, MUS81, NCOA5, NHLRC3, NONO, NPC1, NRIP1, PDCD6IP, PI4KAP2, PIGA, PIP3-E, PPWD1, PTBP2, RARS2, RBM4B, RHOT2, RWDD4A, S100PBP, SEC22C, SEC23IP, SFRS12, SFRS2, SKP2, SLC46A3, SMAP1, SR140, TBCE, TFCP2, TMEM77, TRAM1, TXNDC10, UBE3C, UTP14C, WDR7, WDSUB1, ZNF189, ZNF318, ZNF451, ZNF518B"
M13.10,A2,Protein synthesis,"ABCF1, ABL1, ADNP, ADPRHL2, ALAD, ALKBH6, AP1B1, ASB1, ATPAF1, ATPBD1B, AYP1P1, BCL2L12, BLCAP, C12ORF62, C16ORF44, C16ORF53, C18ORF37, C1ORF123, C1ORF2, C1ORF50, C1ORF77, C20ORF27, C2ORF42, C6ORF136, CHCHD4, CLPP, CTNNBL1, CXORF40A, DPAGT1, DYNC1I2, EIF5B, ETFB, FAM116B, FLJ11286, GMDS, GTF3C6, HMG1L1, HSCB, ILVBL, KCTD21, KIAA0194, KIAA0859, LCMT1, LOC389137, LOC728564, LRRC47, MCTS1, MED29, MIF4GD, MRPL20, MRPL22, MRPL27, MRPL36, MRPS11, MRPS16, MTA2, MYL6B, NPSR1, NUPL2, PDHA1, PLEKHA9, PMM1, PRDM4, PSMC3, RABEPK, RBM4, RNF113A, RUSC1, SARS, SLC2A6, SNAPC4, SPHK2, STK25, STT3A, STX8, TATDN2, THOC4, TIMM22, TMEM189, TMEM69, TMEM93, TOR3A, TP53I13, TRAF3IP2, TRMT1, TSSC4, U2AF1L2, VARS2, ZFAND2A, ZNF362, ZNF511"
M13.11,A26,TBD,"ACTG1, ADIPOR2, ALDH9A1, ARD1A, ARF4, ATP6AP2, ATP6V1E1, ATP6V1F, C14ORF147, C15ORF24, C9ORF156, C9ORF6, CALM2, CAMLG, CD2BP2, CDC26, CLTB, COMMD5, COPA, DCTN2, DDA1, DERA, DNASE2, DUSP22, DUSP23, ELMO2, FADD, GLTP, GMFB, GOLGA7, GSTO1, GTF2B, H2AFZ, HCP5, HEXB, LOC645317, LOC729466, LOC729776, LSM10, MAPRE1, MED28, MGC13379, MRLC2, MTCH1, NEDD8, NIPA2, NPC2, NSF, PDCD6, PEF1, PHF13, PPP2CA, PPP2CA, PPP2R2D, PPP6C, PSMC1, RAB10, RAB9A, RFXANK, RNF181, RNF7, RRAGA, SDHB, SEC11A, SELT, SFRS9, SKP1A, SLC35A2, SMUG1, SUCLG1, TBCC, THAP1, TM2D3, TMBIM4, TMEM59, TUBA1B, UNC50, VDAC3, WDR20"
M13.12,A35,Inflammation,"ACSL1, ADM, AIM2, ALPL, ANXA3, B4GALT5, C16ORF57, C19ORF59, C5ORF32, CA4, CEACAM1, CEACAM1, CLEC4D, CST7, DSC2, DYSF, F5, FCGR1A, FCGR1B, FOLR3, GYG1, HIST2H2AA3, HIST2H2AC, HK3, HPSE, HS.150808, HS.407903, IL18R1, IL18RAP, IL1RN, IRAK3, KCNJ15, KLHL2, LILRA5, LIMK2, LIN7A, LMNB1, LOC153561, LOC440731, LOC648984, LOC728519, MMP9, NLRC4, PFKFB3, PGS1, PROK2, RGL4, S100A12, SIGLEC5, SIPA1L2, SLC22A4, SLC22A4, SLC26A8, TLR5, TNFAIP6, VNN1, ZNF438"
M13.13,A2,Gene transcription,"ACAT2, ALG5, ALG8, ARPC5L, ATP5A1, ATP5C1, BOLA2, BOLA3, BOLA3, C14ORF166, C16ORF33, C6ORF129, C7ORF24, CCDC34, CCT7, CKS1B, COMMD1, COX5A, CUL1, CYCSL1, DDX39, DNAJB9, HNRNPAB, HNRNPAB, HNRNPD, HNRPA2B1, HSPE1, ICT1, LOC134997, LOC341457, LOC652595, LOC653505, LYAR, MIF, MRPL39, MRPS21, MRPS28, MTX2, NDUFA12, NDUFAB1, NOL5A, NOLA1, NOLA2, PGRMC2, PPA1, PRIM1, PSMA3, PSMD14, RANBP1, RANBP1, RPA3, RPL26L1, SHFM1, SSB, SYNCRIP, TCEB1, TXNL2, UCHL3, UTP11L, XTP3TPA, YWHAQ"
M13.14,A2,Proteolysis,"AKR1A1, ATP1B3, ATP1B3, C16ORF61, C2ORF28, CASP3, CBLL1, CCDC32, CCDC53, CCDC59, CCDC90B, CDC16, CISD1, CLDND1, CLDND1, CNIH, COMMD3, CPSF3, CRBN, CWC15, DAP3, DDOST, DHRS4, DIABLO, EIF2B4, EIF4A3, FAM96B, FIBP, FYTTD1, GGPS1, GRSF1, HAVCR2, HSPA4, IGBP1, LOC653566, LSM3, MED6, MGST3, MITD1, MRPL18, MRPL51, MRPS22, MYCBP2, NARS, PMPCB, PPP2R5E, PRDX1, PROSC, PSMA5, PSMB2, PSMC2, PSMD7, PTPLB, SCARB2, SDHD, SELS, SF3B5, SNRPB2, STOML2, SUB1, SYVN1, TCP1, TDG, TFG, TIMM23, TMED9, TMEM85, TRAPPC4, TRIM4, TSPYL1, USO1, XPO1, YWHAG, ZBTB33"
M13.15,A32,Gene transcription,"ALDH3B1, APLP2, ARSD, ATG2A, ATXN7L3, BAT5, C7ORF43, CALCOCO1, CAPZB, CHMP1A, CNOT3, CNPY3, DBNL, DEDD, DGCR2, DNM2, EGLN2, FHOD1, FLII, GARNL4, GDI1, GMIP, GNAI2, GNG5, GRK6, HS1BP3, HSPA1L, IHPK1, KIAA0319L, KIAA0323, KIAA0913, KIAA2013, MAGMAS, MAP1S, MAP3K11, MED12, MGAT1, MGRN1, MID1IP1, MID1IP1, MKL1, MLF2, MLL4, MYH9, MYO9B, NR1H2, OGFR, PACS1, PKM2, PLEKHM1, POLR2A, PPP1R10, PPP1R14B, PTK2B, PTPN6, RAB27A, RAB43, RABAC1, RALY, RBCK1, RENBP, RHBDD2, RHBDD2, RNF40, SCYL1, SIPA1, SP2, STK10, SYTL3, TOLLIP, TRIOBP, TRPC4AP, TSC22D4, UBE1, UNC93B1, UPF1, VPS37B, XKR8"
M13.16,A35,Cytokines/chemokines,"ALPK1, AQP9, BASP1, BCL6, BTNL8, CASP4, CASP5, CR1, CREB5, CSF2RB, FBXL13, FFAR2, FPR2, GK, GK, GPR109A, GPR109B, GPR97, GPR97, GPR97, IL8RB, KCNJ15, KCNJ2, KRT23, LIMK2, LOC641710, LOC642103, LOC642684, LOC652578, LOC728417, LOC728417, LRG1, MAK, MCTP2, MGAM, NAMPT, NCF4, NSUN7, PYGL, RNF149, SLPI, STEAP4, TLR6"
M13.17,A28,Interferon,"ACTA2, ADAR, ADAR, CASP1, CHMP5, CHMP5, DTX3L, GBP2, HS.489254, IFI16, IFITM1, IL1F7, IRF9, LGALS9, NOD2, NT5C3, NT5C3, PARP9, PHF11, PHF11, PSMB9, RNF213, SAMD9, SHISA5, SP100, SP110, SP110, SP110, SP110, STAT2, TAP1, TDRD7, TMEM140, TRAFD1, TRIM21, UBE2L6, ZC3HAV1, ZNFX1"
M13.18,A1,B cells,"ADCK2, ANKRD46, ANXA6, ARL1, ATF7IP2, B3GALT6, BXDC2, C11ORF46, C19ORF12, C21ORF2, C3ORF26, C4ORF27, CCDC76, CD4, CLDND2, CSRP2BP, CSTF3, DPP7, ENTPD6, EXOSC5, FAF1, FLJ12949, FUT8, GOT1, GPR114, H2AFY2, HNRNPU, ITM2C, KLHDC4, KTELC1, LOC388564, LOC644422, LOC653479, LRPPRC, LTBP3, MALT1, MIB2, MRPL1, MRPS12, MRPS26, MUM1, NAPSA, NPIP, NUDT14, PAAF1, PAOX, PDCL3, PDCL3, PELP1, PEMT, PFAS, PHF14, PHYH, PLEKHA1, PNPLA7, POLR1C, POLRMT, PPIE, PPIE, PRMT1, QSOX2, RAI1, RPP40, RRAS2, SAAL1, SETBP1, SETMAR, SH3PXD2A, SLC25A43, SUV39H1, TBC1D4, TFB2M, TMEM116, TMEM99, TOP1MT, TRIAP1, TRMT11, TSHZ1, TSPAN3, TULP4, UFM1, WDR36, XPO4, ZBTB9, ZMYM1, ZNF17, ZNF32, ZNF337, ZNF559, ZNF827"
M13.19,A30,Protein phosphorylation,"MARCH6, AKAP13, ASXL2, BAG4, BANP, BAZ1A, C14ORF102, C1ORF108, C1ORF71, C5ORF41, CARS, CCNY, CEP350, COL4A3BP, DCUN1D1, DNAJB14, DNAJB14, ENTPD4, EP300, FAM101B, GMCL1, GRB2, HS.440088, HS.516646, HS.573541, IFNAR2, ISG20L2, KCTD12, KRCC1, LRRCC1, MAP3K5, MARK2, MSL3L1, NFIC, NUFIP2, OSBPL1A, PDPK1, PIK3CG, PLEKHB2, PLEKHB2, PPTC7, PRPF40A, RAD21, RBM12B, RBM39, RHOQ, RYBP, SESTD1, SGK3, SNTB2, SRPK2, TAOK1, THOC2, TRA2A, TXNDC13, UGCG, UGCGL1, UPF2, USP33, ZBTB43, ZNF12, ZNF148, ZNF281, ZNF641, ZNF654"
M13.20,A29,Cell cycle,"ANKFY1, ANKRD44, C14ORF82, C15ORF28, C22ORF34, C4ORF29, CES2, CTAGE5, DKFZP434K191, ERGIC1, FLJ12078, GSDML, HS.131087, HS.143018, HS.184721, HS.193767, HS.22689, HS.352677, HS.370503, HS.443185, HS.540965, HS.545935, HS.549989, HS.550293, HS.551143, HS.570343, HS.574671, KIAA0492, KIAA1618, LOC158301, LOC284757, LOC402176, LOC440345, LOC650128, LOC650546, LOC653158, LOC728653, MGC12760, POGZ, PPM1B, PRO0628, RAD51, RBM3, RUNDC2C, SOLH, TFAP2A, ZNF93"
M13.21,A2,Cytotoxic lymphocytes,"AUTS2, CD8A, CD8A, CTSW, CX3CR1, FASLG, FEZ1, FLJ20699, GFI1, GNLY, IFNG, KIAA1671, KLRG1, LAG3, MATK, MCOLN2, MLH3, MMP23B, NCALD, NCALD, PRSS23, PYHIN1, PYHIN1, PYHIN1, SAMD3, SAMD3, SAMD3, SAMD3, SYTL2, SYTL2, TARP"
M13.22,A35,Neutrophils,"ACSL4, ADAM8, AGTPBP1, APBB1IP, BCL3, BRI3, C1RL, C5AR1, C6ORF166, CD58, CDA, CHSY1, CPD, CYB5R4, DENND3, DUSP1, EIF4E3, FCGR2A, FCGR2A, FCGR3B, FGR, FLJ20273, FPR1, GRINA, HCK, HSPA1A, IFNAR1, IL8RA, IMPA2, KIAA0247, KIAA1600, KIAA1754, LAMP2, LAT2, LITAF, LOC399744, LOC401357, LOC729021, LOC730820, LY96, MTMR3, N4BP1, NCF4, NFE2, NLRP12, NPL, NPL, NUMB, PGCP, PPP4R1, PSCD4, RALB, REPS2, RNF13, RNF149, RNF24, S100A11, SDCBP, SEPX1, SLC11A1, SOD2, SORL1, SPI1, SPI1, SRPK1, STX11, TRIB1, VNN2"
M13.23,A3,TBD,"ACSL5, ADD3, ANKRA2, ANKRD12, ATXN2, BCLAF1, BTAF1, C19ORF6, C1ORF218, C20ORF11, C7ORF47, CCNG1, CCT6AP1, CERK, CERK, CHD9, CHKB, CLASP1, CLINT1, CMPK1, CROP, CTGLF3, DHX16, EIF2B4, EML3, EWSR1, EWSR1, FAM111A, FAM38A, GLUD1, HARS2, HDAC2, HSH2D, HTR2A, KIAA0528, KIAA2010, LEMD3, LOC729843, LZTR1, MCM3AP, NECAP2, NGLY1, NISCH, NOL8, NSUN2, ORMDL1, OSBP, PCM1, PITPNM1, PLEKHO1, PNN, POGK, POLR3C, PRPF3, PTGER4, RASA1, SCAMP1, SENP7, SGSM2, SLTM, SMC4, SPECC1L, TIAF1, TMC6, TMEM181, TPR, TRPV2, TSC22D2, TSPAN32, U2AF2, UBP1, UBXD8, UTP6, VGLL4, VHL, WDR37, XPC, XPNPEP1, ZBED5, ZC3HAV1, ZNF700"
