ID,Aggregate number,Module title,Member genes
M16.2,A32,Protein synthesis,"AADACL1, ABCC10, ABHD2, ABHD4, ADAM15, ADI1, AGTPBP1, AMPD3, ANKRD50, ARHGEF11, ARNT, ASB6, BCORL1, BNIPL, BTD, C10ORF11, C10ORF56, C16ORF70, C19ORF28, C1ORF26, C1ORF78, C1ORF91, C20ORF67, C3ORF59, C7ORF28B, C9ORF25, CDKN2B, CEP164, CES1, CLIC4, CYB5D1, DAPK3, DCTN1, DOK3, DPH3, DYNC1LI1, EIF2C3, EPDR1, EPHB4, EXT2, FAM125B, FAM89A, FLNA, FRS3, GALNS, GLYCTK, GOLPH3L, GYS1, HNMT, HS.12876, HS.240801, HS.293676, HS.336370, HS.535044, HS.548831, HTATIP, ITSN1, KCNK6, KIAA0415, KIAA1033, KIAA1602, KLF11, KLHL18, KPNA2, LAPTM4B, LGALS9, LILRB4, LOC130355, LOC158830, LOC284837, LOC644677, LOC649422, LOC729764, LOC81691, LUC7L2, MAP6D1, MAPK1, MED15, MSL2L1, MTRF1L, NBN, NFKB2, NFYB, NIT1, NRM, NUDT16, PAPSS2, PCBD1, PDGFC, PFTK1, PHF12, PHF20L1, PIK3C3, PIP4K2C, POLE, POLR2J, PPFIA1, PRKAR1A, PSRC1, PTPRE, RAB11FIP4, RABGEF1, RGL1, RICTOR, RLF, RNF146, RNPEPL1, ROCK1, RPS6KC1, RRM2B, RSPH3, SAMSN1, SAP18, SAP30BP, SEPN1, SERINC3, SFXN5, SIN3B, SIRT2, SLC25A13, SLC25A16, SLC25A29, SLC30A1, SLC35F5, SLC39A8, SLC4A1AP, SLC6A12, SLCO3A1, SMAD2, SNAI3, SNTB2, SNX8, SOAT1, SPHAR, SPIRE1, SREBF1, STARD8, STK11, STK38L, SUPT6H, TAOK2, TBC1D25, TBC1D3B, TBC1D3G, TJP2, TK2, TMEM51, TNFRSF8, TOP1, TRAPPC6B, TRIP6, TTYH2, TXNL4B, UBE2B, USP25, ZMAT5, ZNF230, ZNF282, ZNF446, ZNF580, ZNF785"
M16.3,A6,T cells,"ACD, AKAP10, ANKMY1, APH1A, ATP1A1, ATR, AZI1, BRI3BP, C11ORF17, C14ORF19, C15ORF52, C17ORF68, CASP6, CCDC102A, CCDC106, CCDC21, CCDC58, CCL4L1, CCNC, CD300LB, CD3G, CD8A, CDKN1C, CLN5, CMAH, COLQ, COMMD10, COQ6, CPT1B, CRIP2, CXCL5, DAAM1, DCLRE1C, DERL2, DUS3L, DUSP5, DUSP6, DYNLRB2, DYNLT3, DYRK2, ELOVL6, FAM108C1, FAM113A, FIG4, FLJ14213, FUT6, GCHFR, GIPC1, HDC, HDHD2, HES6, HIST1H2BH, HS.197143, HS.25892, HS.551538, HS.567460, HS.570385, IKIP, ITGA4, ITM2C, KIAA0146, KIAA1683, KLRC2, LAIR2, LCK, LGALS2, LIX1L, LOC130773, LOC149448, LOC205251, LOC441743, LOC642083, LOC642197, LOC645236, LOC649754, LOC649841, LOC651575, LOC651751, LOC728715, LOC730746, LRRC14, MAP7, MARCH1, MATR3, MGC61598, MRPL38, MST1, MYOM2, NIPSNAP3A, NME2, NR2C2AP, NT5E, OMA1, PICK1, PIGX, PIK3C2B, PPIE, PRMT2, PRPF38A, PTP4A3, RAB11FIP5, RASA3, RBMX2, RG9MTD1, RGS12, RIN2, RNF5, RNPC3, RUNDC2C, S100PBP, SDHAP3, SEC22A, SEDLP, SEPT6, SIGIRR, SLC45A3, SLC7A6, SMARCA5, SNF8, SNORD31, ST6GALNAC6, SULT1A3, SULT1A4, SWAP70, TAPT1, TARBP1, TBRG4, TERF1, TIA1, TKTL1, TMEM137, TMEM62, TMEM80, TNFRSF4, TRIB2, TSPAN3, USMG5, VSTM1, XRCC1, YPEL1, ZNF212, ZNF264, ZNF266, ZNF330, ZNF91"
M16.4,A6,TBD,"ACTR8, AGMAT, ALG11, AMMECR1, ARMCX3, ASPSCR1, ATAD2, BBS7, BRI3BP, C10ORF61, C12ORF49, C14ORF130, C15ORF44, C1ORF156, C21ORF59, C5ORF24, C6ORF105, C8ORF70, CASK, CCNYL1, CENPL, CEP68, CHN2, CLUAP1, DIABLO, DNAJC19, DNAJC21, DOCK9, EARS2, ERCC1, FAIM, FAM3C, FANCL, FASTKD2, FASTKD3, FBXO22, FBXO32, FUBP1, GPAM, GPR180, GRAMD3, GTF2H3, GTPBP8, HNRNPF, HS.284464, HS.352549, HS.443490, HS.527071, HS.534439, HS.561603, HS.88156, HSGT1, HSPA4, IL12RB1, IMMP2L, IVD, LOC153364, LOC642178, LOC644096, LOC644869, LOC647009, LOC650845, LOC652324, LOC652615, LOC653234, LOC653383, LOC731999, LOC90624, LRP8, LRRC20, MCPH1, MTFR1, NARG1L, NME6, NOTCH2NL, NR1D2, NSUN5C, NUP35, NUP35, OSGEPL1, PCBD1, PCGF6, PDCL, PEX7, PIBF1, PTCD2, RAB23, RAD51C, RBM3, RBM41, RFC1, RNF8, RPL23AP7, RPL32, RYK, SBDSP, SDHALP1, SERPINB9, SIP1, SLC10A7, SLC4A7, SLFN12, SMA5, SNAPC5, SOCS2, STAG3L1, SYNJ2, TAF1A, TBCE, TDRD3, THNSL1, TIAM1, TIGD2, TMEM189-UBE2V1, TNFRSF25, TRIM24, TUBE1, TXNDC15, USP37, VPRBP, WDR43, XYLT1, YAF2, YTHDC2, ZGPAT, ZHX1, ZNF136, ZNF235, ZNF236, ZNF426, ZNF669"
M16.5,A32,TBD,"ABAT, ADAM10, ADHFE1, AGER, AGGF1, AGPAT2, ARHGAP18, ARRDC4, ATG4D, B3GNT5, BCAP29, BCL10, BOK, BRWD3, BZW1, C10ORF47, C14ORF11, C19ORF33, C2ORF34, C2ORF65, C6ORF89, CAND2, CAPN7, CCDC124, CCDC22, CCDC25, CCDC88A, CD151, CLDN18, CLEC1A, CMTM1, COMMD8, CSNK2A1P, CXCR6, CXORF20, CYP51A1, DCLRE1A, DENND1A, DNAJC3, ECSIT, EIF4E, EPB41, FAM13A1, FAM69B, FGFR1OP, GFI1B, GLT1D1, HIST2H3C, HMBS, HOXD13, HS.524705, HS.543470, HS.566280, IFRD2, KCNH3, KISS1R, LOC402057, LOC645937, LOC648659, LOC649260, LOC649801, LOC650263, LOC652634, LOC729905, MAP3K7, MAP4K5, MARCH3, MARCH5, METRNL, METTL9, MFHAS1, MGC40489, MPDU1, MS4A4A, MTMR3, NAPA, NDUFV3, NFIA, NHS, NMNAT3, OXER1, P2RY12, PIK3R5, PKM2, PLEKHN1, PPIB, PRDM10, PRR5, PSCDBP, PSEN1, RANBP9, RFX2, RMND5A, RNF175, RTN2, SLC22A16, SLC24A3, SLCO4C1, SPAG1, SPTY2D1, SSFA2, ST7, STCH, STX5, SUMO1, TAC3, TAPBP, TCIRG1, TIPRL, TMEM164, TNFSF13, TNNC2, TOMM40L, TP53I3, TPM4, TPM4, TRPM2, TSNAX, VPS13B, WDR81, YIPF5, ZMIZ2, ZNF136, ZNF32"
M16.6,A8,Monocytes,"ACADS, ACOT8, AGPAT6, ALG14, AP1S1, ASB3, ATPAF2, B4GALT4, BATF3, C15ORF23, C15ORF44, C18ORF19, C19ORF48, C1ORF112, C1ORF76, C5ORF22, C7ORF29, C9ORF23, CCL3, CCL3L1, CD40, CDCA7, CECR5, COBRA1, DDHD2, DDX12, DDX19B, ELMO1, ELMO2, EPM2A, ETNK1, FER1L3, FYTTD1, G3BP1, GCDH, GCH1, GLE1, GSK3A, GSTZ1, GTSF1, GUF1, HNRNPA1, HRASLS2, HS.173957, HS.353387, HS.495112, HS.547738, HS.548415, HS.570229, INSIG1, INTS7, JSRP1, LENG1, LGALS3BP, LOC201164, LOC388122, LOC441050, LOC541471, LOC649214, LOC650557, LOC653066, LOC654346, LOC730051, MAGEF1, MAPKAP1, MCRS1, MED11, MGC40489, MGC4172, MRPL4, MSTP9, MT1G, NAF1, NFKBIB, NHLRC2, NUBP2, OVOS2, PAK4, PARP3, PLEKHG4, POLDIP3, POLR2K, PRMT7, PRRT3, PSMD3, QTRTD1, RBKS, RBL1, RIOK1, RPL39L, RSU1, SCD5, SLC25A24, SLC25A26, SLC27A5, SLC35F2, SLC3A2, SNURF, SNX5, SPATS2, SPG21, SQLE, SSR3, STARD5, TAF1A, TCP11L1, TCTEX1D2, TNIP2, TOP1MT, TRUB2, UBE2J2, UBTD2, USP22, WDR25, WFS1, ZDHHC24, ZNF655, ZNF664, ZNF707"
M16.7,A2,TBD,"ACAD10, ALG9, ANKRD27, ATXN10, BCAP29, BYSL, C10ORF61, C12ORF30, C17ORF39, C17ORF59, C17ORF81, C19ORF29, C1ORF109, C3ORF26, C5ORF3, CAPN10, CCDC127, CDCA4, CHCHD8, CLUAP1, COMTD1, DCTD, DDX26B, DDX31, DFFA, DRG2, EIF1AX, ELP4, ENDOG, EXOC2, EXOC2, FAM26B, FARSA, FASTK, FBXW9, FMO4, GAMT, GATA3, GNB1L, HDHD3, HS.40289, HS.430851, HS.508889, HS.556082, IDH3A, INPP5B, IPO9, KIAA0125, KIAA0195, KIAA0460, LANCL2, LIG3, LIMA1, LOC653071, LOC729985, LOC90120, LRRC37A4, MADD, MAPKAPK5, MARS2, MBIP, METTL1, MIB1, MORG1, N6AMT2, NBPF14, NCAPD3, NMT1, NOB1, NOLC1, NUP54, NUP62, OTUD6B, PALB2, PDIA4, PFKM, PHC1, PMS2L5, PNKD, POLA1, PPIL1, PRKAB2, PSMG3, RCL1, RNASEH2A, RPL39L, RUFY3, SEH1L, SFMBT1, SHQ1, SLC25A4, SMC2, SMYD4, SNX25, SYMPK, TCEAL1, TCERG1, TCF3, TPP2, TRAF1, TSGA14, TUT1, UQCR, USP11, WDR33, WDR60, WDR79, XPO5, ZBTB25, ZBTB5, ZBTB8OS, ZC3H8, ZCCHC3, ZCWPW1, ZNF618, ZNF74, ZNF831"
M16.8,A6,TBD,"ABCB6, ABCF2, ACRC, ACSM3, AFAP1L2, AGL, AMN1, ANKRD17, ARL6IP4, BCAT2, BCL2L2, BLM, BMPR2, C14ORF131, C16ORF75, C1ORF66, C20ORF196, C6ORF1, C6ORF106, C6ORF120, C6ORF64, C9ORF91, CARS, CCDC69, CCDC90B, CDK5, CEBPE, CHERP, CHRAC1, CHRNB1, CLTC, COG1, COPS8, CXCR5, DDX19A, DEFB131, DHDDS, DHX9, DIS3L2, DNM3, DUSP16, FAM105A, FBXW11, FIBP, FIGNL1, FLJ20125, FUNDC1, GFRA2, GMPPB, GPATCH1, GPR137B, GTF2H1, GTF2IRD2B, HP1BP3, HRSP12, HS.245405, HS.538554, HS.538962, ICA1, ICMT, LMAN2, LOC440145, LOC642017, LOC652545, LOC728944, MED8, MFN1, MTHFD1L, MYOM1, NCKIPSD, NDFIP1, NFYA, NLRP1, NOD1, NUDT15, OGFOD1, PCBP4, PDE12, PIGN, PIK3R4, PMF1, PPIA, PPP1R12B, PRKAG2, QTRTD1, RAB4A, RANBP3, RASSF6, RCBTB2, RETSAT, RFXANK, RPS6KC1, RPS7, SCAND1, SLC38A10, SLC9A9, SNORA7B, SON, ST3GAL3, STAU2, SULF2, THADA, TIGD7, TIPRL, TMEM177, TRA1P2, TUBG1, UBL5, UBXD4, UHRF2, VAMP4, VAMP4, ZFYVE27, ZNF397, ZNF585A, ZNF706, ZNF776"
M16.9,A32,Protein modification,"ABCG1, ACTB, ACTR2, ADCK4, AFTPH, AKAP8L, ARIH1, ARSG, BAP1, BAX, BRMS1, BTBD7, C10ORF28, C1ORF25, C20ORF107, C20ORF121, C6ORF32, C6ORF61, CCNT2, CDC42, CMIP, COG4, CORO1A, CPNE1, CXORF38, CYLN2, DEDD2, DHRS7B, DICER1, DMD, EDEM3, ESRRA, EXOC1, FLJ90757, FXR2, GALNT4, GBA2, GOLGA2, GOLGB1, GOLPH3, GPC6, HIF1AN, HS.324250, HS.554203, HS.568777, HSD17B11, HTRA2, IFFO, IRF2, JMJD1C, KEAP1, KIAA0556, KLC1, KLF6, LOC283874, LOC643738, LOC648605, LOC649661, LOC730740, LOC732425, MARK2, MGEA5, MPPE1, MTHFR, MYST1, NCOR1, NIPBL, NKIRAS2, NLRX1, NPLOC4, NR3C1, NSF, OGFRL1, PIGG, POLD3, POLR2C, PPM1D, PPP1CA, PPP3CA, PRKAG1, REEP4, RNASET2, ROCK2, SELO, SERINC3, SETD1B, SH3MD4, SKI, SLC23A2, SLC25A14, STAMBP, STK35, TAZ, TBL1XR1, THOC2, TMEM1, TMEM159, TNFAIP8L2, TRIP11, TSC1, TSC22D3, TYK2, UBE3B, WDR45L, WDR48, XRCC5, ZDHHC6, ZNF350, ZSWIM4"
M16.10,A3,TBD,"ACY1, AK2, ALMS1, ARMCX5, ASNS, BNIP1, C10ORF35, C11ORF61, C16ORF52, C19ORF39, C1ORF142, C1ORF69, C21ORF51, C2ORF7, C6ORF57, CACNA1H, CAPN12, CCDC65, CCS, CD244, CROT, CRTAP, DDX51, DOPEY1, DTX3, EID3, ERBB2, FDX1L, FLJ20628, FLJ23584, FLJ38969, FLJ39653, GCET2, GPAM, GUCA1B, HABP4, HISPPD2A, HPS4, HS.121070, HS.400256, HS.497591, HS.555260, HS.576735, HS.576825, HS.86045, HSPC047, IL11RA, L2HGDH, LARS2, LEAP2, LOC285359, LOC400713, LOC401218, LOC554206, LOC644128, LOC650799, LOC727762, MED9, MEI1, METT10D, MGC39900, MIPEP, NAT14, NMT2, NOXA1, NR2C1, NY-SAR-48, OLFM1, PACSIN1, PCYT2, PKD1, PLAG1, PMS2, POL3S, PPP1R3F, PTER, PTGDR, RAD17, RIMS3, SARM1, SELI, SEPT1, SFMBT1, SLC41A1, SMC1A, SNORA33, SNORD35B, SPATA7, TELO2, TMEM191B, TP53AP1, TRSPAP1, WDR74, XIST, ZNF133, ZNF154, ZNF285A, ZNF3, ZNF34, ZNF35, ZNF431, ZNF525, ZNF594, ZNF616, ZNF772"
M16.11,A4,Protein synthesis,"ANGPT1, ANKHD1-EIF4EBP3, ANKRD6, AURKA, AZIN1, BA16L21.2.1, BBS10, C10ORF63, C14ORF28, C17ORF58, C17ORF58, C17ORF65, C19ORF54, C9ORF32, C9ORF64, CBLL1, CLEC4C, CREB1, CXCL5, DEF8, DGCR14, DIDO1, DLEU2, DONSON, EIF2S2, EXOC5, FAM101B, FLJ43692, FLJ45244, GLRX2, GOSR1, GPR34, GPSM2, H6PD, HAX1, HS.408455, HS.438858, HS.444683, HS.461819, HS.48729, HS.527535, HS.537002, HS.570838, HS.571946, IMPAD1, INPP4A, KIAA0226, KIAA1797, KLC1, LOC143666, LOC255620, LOC642233, LOC642255, LOC642921, LOC642946, LOC643713, LOC649270, LOC727935, LOC732172, MAN1A2, MAP7, MGC42367, NETO2, NLRP2, NONO, NOV, PDSS1, PHACTR1, PHF16, PLEKHJ1, POU2F1, PSEN2, RCHY1, RGPD1, RPL29, RPL29, RPS6KA2, RSC1A1, RTF1, S100Z, SCCPDH, SCML4, SEL1L, SERPINI1, SETD4, SIL1, SLC25A14, SLC2A5, SNORA32, SPATA2, SPG3A, SPRY1, TM9SF1, TMUB2, TRAF3, TRAK1, TRIM37, TRIOBP, VPS13D, ZFYVE1, ZNF250, ZNF333, ZNF509, ZNF626"
M16.12,A15,B cells,"ACTN2, AKAP11, AMACR, ANKDD1A, AP1GBP1, APOBEC3F, ARRDC3, BCOR, BRCA1, C10ORF46, C13ORF25, C6ORF150, C7ORF20, C9ORF38, C9ORF84, CAB39L, CC2D1B, CCDC100, CCNL2, CD84, CEP152, CEP170, CLIC5, CUGBP1, DLL1, ERBB2IP, EXOC1, FAM108B1, FCGR2B, FLJ43663, GALNT6, GLB1L, GTPBP10, HMG2L1, HS.129244, HS.191230, HS.373705, HS.493947, HS.512090, HS.558488, HS.561954, HS.567477, HS.567480, HS.570330, IL2RA, INTS4, KENAE, KIAA1627, LBH, LIG4, LINS1, LOC440354, LOC441511, LOC645600, LOC646144, LOC648494, LOC648509, LOC651316, LOC652455, LOC652773, LOC728127, LOH11CR2A, LRRC16, MLL3, MS4A2, NEDD9, NFX1, PDLIM5, PEX26, PHF11, PHTF2, PMS2L1, PMS2L3, POLR2J4, POT1, PXMP4, RAB24, RAP1GDS1, RPL37, S100PBP, SEPT2, SGTB, SH3BP2, SLC38A1, SON, SRP54, STAU1, SUV420H1, TMTC3, TXNL4A, UBE2E1, USP42, USP9Y, VPS13B, VSTM3, WDR23, XPOT, XRN1, ZNF292, ZNF623"
M16.13,A5,Protein modification,"AFAP1L2, AKR1C4, ANXA4, ASCC3, BCL11A, BTG3, BZW1, C10ORF58, C11ORF73, C14ORF145, C20ORF103, CAMK2D, CAMK4, CASP6, CBR3, CHI3L2, CNTNAP1, CORO2A, DBT, DKFZP564O0823, ERC1, FAM102A, FAM122A, FAM86A, FLJ22795, GEMIN8, GOSR1, GSTM3, GTSCR1, GUSBL1, HDGFRP3, HKDC1, HS.46689, HS.494932, HS.551815, HS.558072, HS.571417, IFT88, KLHL14, LEO1, LOC153364, LOC400566, LOC402560, LOC644131, LOC650321, LOC653115, LOC653354, LOC654074, LOC727825, LOC728518, LOC728554, MARCH5, METTL2A, MGC29891, MINPP1, MOBKL1A, MOCS2, MRPL19, MRPL30, MSH2, NDNL2, NKAP, NUP43, ORMDL1, PABPC1, PCGF6, PLS1, PRKCI, PSMB8, PSMD10, PTRH2, R3HDM1, RASGRP2, RBBP4, REG4, REPS1, RPL37A, RPSA, SLC39A14, SMC3, SOCS5, TAF9L, TCP1, TMCC1, TOP1MT, TSHZ2, TSPYL2, TUBB6, ZC3H7A, ZNF254, ZNF294, ZNF611, ZNF626, ZNHIT2"
M16.14,A6,TBD,"AACS, ABCF3, ABHD12, ADCK1, AMDHD2, ARRDC1, ATP13A2, ATRIP, ATXN2L, ATXN7L2, B3GAT3, BMF, C10ORF2, C16ORF79, C20ORF29, CABLES2, CAD, CAMK1, CAPN3, CD99L2, CECR7, CLIP2, CSNK1E, CYB561, CYP4F12, EDC3, EPHB6, FAHD2B, FAM78A, FLJ10404, FLJ20254, G6PC3, GATA2, GSTT1, GTF2H4, HMG20A, HYOU1, INPP5E, IPO4, KIAA0406, KIAA0664, KIAA1394, KIAA1787, KIFC2, LOC338799, LOC348262, LOC645904, LRDD, LRDD, LTBP4, MAGED2, MBD3, MECP2, MED24, MPP5, NAGLU, NAT6, NOL1, NY-SAR-48, OBFC2B, PEX14, PIGO, PLCD1, POMT1, PPARD, PPP1R12C, PTGDS, RAI16, RHOF, RMND5B, SART3, SELM, SGSM3, SLC29A3, SLC4A2, SMAD7, SNORA10, SNTA1, TBX19, TIMM44, TMEM9, TPM2, U2AF1L4, UAP1L1, VAC14, VAT1, VAV3, ZNF193, ZNF276, ZNF513"
M16.15,A4,Cell death,"ADAM17, AMY2B, BIN3, BTBD11, BTBD14A, BTF3L4, C11ORF38, C14ORF139, C19ORF42, C20ORF191, C2CD2, C3AR1, CALCOCO2, CASP8, CCDC140, CDK5R1, CMTM8, CPEB2, EIF4G3, FANCD2, FCGR2B, FER1L3, FLJ10213, FNDC3A, FRAG1, FRAP1, FYCO1, GCH1, GNE, HADHA, HEATR1, HEXDC, HIPK2, HIST2H4A, HS.130916, HS.142570, HS.170035, HS.202577, HS.356079, HS.447737, HS.482960, HS.512096, HS.531457, HS.553301, HS.562660, HS.573047, HS.576633, HVCN1, IKIP, IRAK2, KHSRP, KIAA1530, KLHL8, LOC389286, LOC641825, LOC644591, LOC645489, LOC651309, MAPK13, MFGE8, MRP63, MTA1, MTX3, MYBPH, NIN, NIN, PAICS, PAQR8, POLR3A, PPP2R3A, RFWD3, RNF138, RNF144, RRBP1, SETX, SLC25A22, SON, SSR2, STAM2, SUMF1, TPRKB, TSEN2, TXK, U1SNRNPBP, U1SNRNPBP, ZNF493, ZNF529, ZNF828"
M16.16,A32,TBD,"ABP1, ALAS1, ARL15, ARRDC4, AVP, BACH1, BRD4, C14ORF21, CASP9, CCDC47, CCR2, CD97, CHD3, COMT, CRK, DC36, DLG4, DNASE1L1, ECE1, ELMO3, EPAS1, EPB41L4B, FADS1, FAM20C, FAM70B, FLJ37453, FRMD4B, GINS4, GOLPH4, GTDC1, GTF2A1, HIPK3, HS.16587, HS.171481, HS.203201, HS.484363, HS.515681, HS.553962, HS.573555, INSC, KIAA1715, KRTAP19-6, LATS2, LOC196549, LOC643505, LOC646043, LOC646103, LOC648710, LOC652699, LOC653127, LOC729692, LPAR4, LRRC6, LSP1, MAPK8IP1, MGST1, NECAB2, NFKBID, OPRL1, PAK2, PRKCDBP, PRRG4, PSMD13, PTPRE, PTPRJ, RRBP1, RUFY2, S100A7L2, SDC1, SEMG1, SERPINB2, SH2B2, SLC16A5, SLC37A3, SOS2, STAP2, STK40, TBC1D3C, TFPI, THBD, TMSB4X, TNFRSF12A, TRIM41, UBE2R2, UFD1L, USP33, VEGFA, ZNF228"
M16.17,A17,Gene transcription,"ABCD3, ADAMTS4, AFAP1, ARID5A, ARMC8, ARPC4, ARPP-19, ATP5L, AUH, BAT3, BEX1, BMP2K, C3ORF63, C5ORF21, CALML4, CC2D1A, CPM, CSNK2A1, DDR1, DEDD, DNAI2, DYDC2, EFNA4, EIF5, FAM73B, FEZ1, FXC1, FXYD5, GCM1, HIGD1A, HIST1H2BJ, HOXB6, HOXB6, HS.436060, HS.436679, HS.557590, HS.558911, HS.561130, HS.573549, HS.576373, HTRA2, IRF2, IRF2BP2, KRTAP20-2, LGALS12, LOC440258, LOC642082, LOC644117, LOC644482, LOC644846, LOC646135, LOC647890, LOC653073, LOC653720, LOC654161, LOC654260, LYPD1, MBP, OLFM1, PDGFA, PHF1, PIGA, PLAC2, PPFIA1, PRR3, RAB4B, RGS6, RNF214, SF3B1, SLC25A20, ST5, STMN2, STX5, SURF2, TCTA, TCTEX1D1, TRIM13, TRIO, TROVE2, UBC, VPS24, VPS24, ZFAND2B, ZNF10, ZNF473"
M16.18,A5,TBD,"AHI1, BBS9, C11ORF31, C16ORF14, C17ORF75, C18ORF54, C1ORF149, C1ORF165, C1ORF97, C21ORF45, C5ORF20, CCDC111, CD3D, CORO1B, CRYBB2, CYP2U1, DCHS1, DFNA5, DISP1, DKFZP564O0523, DOCK7, DSC1, DSC1, EFNA1, ERCC2, EXTL2, FAM24B, FTSJ3, GCET2, GIT1, GNA11, GPATCH4, GPR55, HS.185764, HS.46839, HS.569104, KIAA0133, KIF21A, LOC401431, LOC648605, LOC652837, LYPD2, MGC52282, MPP6, MTP18, MYST2, NANOS1, NMUR1, NR3C2, NRCAM, PABPC3, PER3, PHLPPL, PLCL1, PPAP2A, PPIL3, PTDSS2, RAGE, RGMB, RPL10L, RTKN2, SALL2, SERPINH1, SLC12A2, SLC20A2, SLC29A2, SNRPD1, SPAG16, SPINK2, TAF6, TBCCD1, TCEAL1, TCEAL4, TMTC4, TNC, TOX, WDR5B, ZNF181, ZNF280D, ZNF415, ZNF416, ZNF543, ZNF681"
M16.19,A18,TBD,"ACCN3, ADAM15, ADCY2, AGPAT3, AP2A1, AP4S1, ARL4A, BRD4, C5ORF4, CDC42EP1, CLEC14A, CLIC2, CMTM3, DMRTB1, DPYSL5, EPB41, EPHA8, ERO1LB, FAM21C, FARP2, FGF23, FIBCD1, FIT1, FLCN, FSD1, GCOM1, GPR175, HOXD3, HS.116870, HS.137598, HS.149244, HS.242159, HS.352818, HS.423336, HS.538990, HS.543865, HS.544069, HS.545454, HS.552431, HS.557481, HS.559564, HS.564949, HS.566514, HS.578895, HS.579013, HS.579479, HS.582701, ICAM4, IRX1, KCMF1, LARP4, LOC161527, LOC285453, LOC402066, LOC642468, LOC643272, LOC647363, LOC649604, LOC653765, MBNL3, MEGF10, NCAN, NR1D1, NRIP3, PHF2, PPP2R4, RGR, RHPN1, RNF187, ROPN1B, SDSL, SLC30A3, SLC35A2, SMPD4, SNHG10, SRGAP2, SS18, STEAP3, SUV39H2, TRIML1, YIPF2, ZBTB7B"
M16.20,A23,TBD,"ARL6IP4, ART4, ASH1L, ATF7, ATP5G2, C17ORF73, CETN1, CHRNA2, CRB3, CST9, DPCR1, FAM21B, FER1L5, FLJ32955, FRMPD3, GBAP, GLIPR1L2, GPC5, HCN3, HDLBP, HS.125470, HS.441213, HS.505855, HS.541100, HS.548213, HS.560732, HS.566764, HS.573497, HS.578850, HS.581662, HS.98466, IL17RC, INPP5A, LOC145820, LOC283174, LOC283871, LOC284194, LOC340113, LOC642316, LOC642740, LOC643834, LOC645079, LOC646604, LOC647778, LOC648526, LOC650620, LOC651137, LOC651763, LOC652045, LOC652231, LOC652673, LOC653696, LRP2BP, MAPK15, MUSTN1, NCDN, NFKBIZ, NLGN2, OR1L8, OR2T12, OR52D1, OSBPL3, OXCT2, PADI1, PDZD11, PGLYRP4, PLA2G10, PLCB1, PPP2R3A, PRICKLE2, RNASE10, RTN3, SCP2, SERPINB7, SLC16A2, SOX30, SP6, TFAP4, ZNF470, ZNRF3, ZWINT"
M16.21,A15,TBD,"ATXN2L, C11ORF61, C6ORF60, C6ORF85, CCDC15, CENPJ, CHTF18, CLEC2D, CTAGE6, DCBLD2, DMXL1, DNA2, DPY19L4, ERMN, FANCB, FOXP1, GAL3ST4, GIGYF1, GRASP, H2AFJ, HERC4, HNRPH1, HS.117299, HS.128708, HS.145307, HS.442773, HS.443189, HS.547551, HS.561656, HS.565244, ICOSLG, IFT88, IGSF9B, KLHL17, LOC643438, LOC643453, LOC644845, LOC648226, LOC648453, LOC648749, LOC650114, LOC652479, LOC653524, LOC653596, LOC729137, LYG1, MASTL, MPI, NEIL1, NFRKB, NR1D2, NUMA1, PCYOX1L, PLGLB1, PRR3, RABL2B, RBBP6, RG9MTD2, RNPC2, RUFY2, SAMD1, SASS6, SEC31B, SLC23A3, SLC4A8, SUMO4, SYNE2, TAF1, TMEM16J, TUBE1, TXNDC4, UGP2, VAPA, WDR86, WHSC1L1, ZNF225, ZNF335, ZNF514, ZNF598, ZNF673"
M16.22,A33,TBD,"ACSL3, ADAM9, ANKRD34B, AQP12A, ATP9A, ATPBD1C, BCL6, C14ORF101, C9ORF106, CCDC147, CLEC5A, COL17A1, CXCL14, DISC1, GPR42, GPR77, HIPK3, HPGD, HS.128615, HS.208623, HS.369978, HS.474713, HS.544245, HS.563795, HS.566482, IGF1R, IL4R, IVNS1ABP, KIF1B, KREMEN1, LAT2, LILRA6, LOC400499, LOC400499, LOC440525, LOC441124, LOC641693, LOC642120, LOC642816, LOC646309, LOC646424, LOC653867, LOC730953, MAST4, METTL7B, MYO10, NTNG2, PADI2, PCOLCE2, PGM5, PNRC1, RAB27A, SERPINB10, SERTAD3, SLC25A40, SLC26A8, SMARCD3, SOCS3, STRN, TMCC3, TMEM119, TMEM185B, TMLHE, TNCRNA, TOM1, TOR1AIP2, TP53I11, TPH1, UPB1, UPP1, USP32, VASP, VNN3, WDFY3, WDR38, ZAK, ZNF254"
M16.23,A17,Cell cycle,"ADCK5, ALG11, ANKRD32, APOO, ARID4A, ATPBD3, BMF, C10ORF141, C11ORF74, C17ORF79, C21ORF58, C6ORF211, C9ORF7, CCDC126, CCDC18, CHST2, CSHL1, CSNK1G3, CYORF15A, CYORF15B, DNPEP, EGR3, EIF1AY, EIF1AY, EXOC4, FKBP4, FLYWCH2, FMO6P, FOXRED2, FUS, FZD1, GCNT2, GINS3, GOLPH4, GPM6A, HINT3, HS.558286, HS.98330, HUS1B, IKZF2, ISYNA1, JARID1D, KCNN4, LOC400566, LOC642236, LOC728734, MAP2K7, MED22, MOCS1, MPDU1, MRE11A, NEO1, NR2C2, PAIP1, PAPOLG, PGGT1B, PIAS2, PINX1, POLR3F, PRKY, PSMD11, RPS4Y1, RPS4Y2, SFXN4, SMU1, SPTLC1, TCHP, TMEM180, TNFSF8, TRIM39, TSPAN17, UTY, VPS41, WHSC2, WNT16, ZNF3, ZSWIM3"
M16.24,A6,T cells,"ATP2C1, BIN2, BP75, C14ORF43, C2ORF18, C7ORF28B, CAPN7, CAPRIN1, CAPRIN2, CD82, CD8B, CD8B, CLASP2, COG3, CYP27A1, DGCR14, EPC1, EZH2, FAM134B, FXR1, GALT, GART, GPR132, GSTM1, HAPLN3, HNRPH2, HPS3, HS.250648, HS.443123, ITPA, KIAA1429, KIF3B, LCP2, LOC649210, LOC650034, LOC652694, LOC727848, MAFG, MAML1, MBD1, MBD2, MBTPS1, MIA3, MPEG1, MRPL47, NDUFA10, PJA1, PKN1, POU2F2, PPP2R5D, PTP4A3, PTRH1, QRICH1, RBM15B, REL, RUVBL1, RUVBL2, SATB1, SDCCAG3, SH2B1, SH2D3C, ST6GAL1, TAZ, TCF7, TCF7, TPP2, UBAP2, UQCC, UTP14A, WASF2, WDR20, ZC3H14, ZFX, ZNF37A"
M16.25,A6,TBD,"ACLY, APTX, ARID2, ARS2, ASB3, ATAD1, C15ORF40, C17ORF63, C1ORF52, C1ORF97, C8ORF76, CAMSAP1, CAPRIN1, CASP2, CCDC95, CD1A, CHD1, CLK2, E2F6, EIF4B, FAM104B, FAM39DP, FGD2, GSG1L, HCCS, HS.126245, HS.573264, INOC1, INPP5F, INTS1, LOC23117, LOC440341, LOC613037, LOC653344, LOC90379, LOC91561, MAP3K14, MBNL1, MED23, MPHOSPH8, NT5DC1, ODF2, PDIK1L, POFUT1, PREPL, PRPF8, PWWP2B, RBBP5, RBED1, RBM10, RNF34, RORA, RPS27, RSBN1, RSRC2, SCYL3, SLC35C2, SMARCAL1, SMN1, SNAPC3, SPIN1, TBCD, TLE1, TTC15, UBE2D2, UBXD2, USP48, VPS52, XPR1, ZC3H4, ZCCHC9, ZNF187, ZNF549, ZNF654"
M16.26,A26,TBD,"AADACL1, ACACA, ACOX3, AMZ2, AP1S2, ARL6IP5, ATF4, AURKAIP1, BCAP31, C11ORF54, C11ORF68, C20ORF177, C5ORF15, C8ORF41, CALM1, CCND3, CDC37, CDCA4, CDV3, CFL1, CLEC10A, CMTM7, CPSF3L, CSK, CTSH, DEGS1, DNAJA1, ELF4, ERLIN2, ERN1, FAM103A1, FAM89A, GDI2, HMGCL, HS.569162, HSP90B1, LOC401052, LOC401152, LOC653874, MAD2L2, MDH2, MOSPD3, MTHFD2, N-PAC, NDC80, NFKBIB, NSMCE2, PAQR4, PARD6A, PDIA5, PDLIM7, PFN1, PGK1, PGLS, PHF19, PREB, SDHC, SETD3, SLC9A6, SORBS3, SSU72, SULT1A3, TADA3L, TATDN3, THAP7, TMEM149, TTF1, UBC, VAMP7, VPS37A, ZDHHC3, ZFPL1"
M16.27,A32,TBD,"ADD1, AP3S2, ARF3, ATG3, ATP7A, BTBD7, C10ORF47, C6ORF151, CCDC131, CDH2, CHMP4B, COX6B1, CUL4A, DHRSX, DNAJC13, EIF4EBP3, EIF4G2, FAM69A, FBXW11, FBXW2, FCN1, GIMAP4, GTF2E1, H2AFY, HS.363526, HS.369017, HS.426929, HS.534680, HS.556018, HS.563361, HS.568690, HYAL3, JTB, KIT, KLF12, KLF2, LASP1, LOC643389, LPIN2, LTA4H, LY6G5C, MLL5, MPZL2, P2RY2, PAQR7, PIGO, PKNOX1, PKP4, PLEKHM2, PURB, RAB37, RRAGB, S100A4, S100A9, SCAND1, SEC16A, SGPL1, SPHK1, SSH3, STK24, TMEM11, TRERF1, TTC9C, TTLL4, UBR4, UNC13A, WDFY2, WHSC1L1, ZHX2"
M16.28,A15,TBD,"ADRA2A, AKAP11, ATRX, BCAS4, BMP8B, BRUNOL6, BTBD1, C17ORF80, CBX2, COG5, CXORF15, CYORF15B, DDB1, DIDO1, FAM156A, FLJ37464, FLJ40113, FLJ45966, GGPS1, GPM6B, HELB, HS.186848, HS.563639, HS.570617, HS.572495, HS.577681, HS.579070, HS.72010, IL6ST, KCTD5, LHFPL3, LIG3, LOC163233, LOC202181, LOC388237, LOC440349, LOC641978, LOC644284, LOC648490, LOC652184, LOC652790, MGC70863, MRRF, MTERFD2, NFATC2IP, NGFRAP1, NR2F2, NSUN5B, PARP15, PCBD2, PHKB, PHOSPHO2, PILRB, PMS2L1, PPP1R16A, PRRT2, RABL2A, RG9MTD3, SEC23A, SHOX2, ST3GAL1, STRC, TRAPPC2, ZBTB39, ZMYM5, ZNF286A, ZNF586"
M16.29,A8,TBD,"ABCC1, ANKRD26, ARMC10, BCOR, CAMK2D, CASP6, CDK8, CDKAL1, DHFRL1, DUSP10, ECHDC1, ERO1LB, FAM76A, FIGNL1, GALNT12, GATC, GFPT1, GOLGA6B, GRINL1A, HLTF, HS.540121, HS.567392, HS.575603, HS.62314, KIAA0776, LBH, LIN9, LOC201725, LOC388681, LOC645052, LOC96610, LRRC40, MAML2, MAP4K3, MCCC2, MDN1, METTL6, MYST4, N6AMT1, NARG2, NUS1, OPN3, OR7E156P, PARG, PDE6B, PIGW, PKD2, PPP2R1B, SLAIN1, STMN1, THYN1, TNRC6C, TRIM35, VNN2, ZBTB38, ZNF121, ZNF138, ZNF493, ZNF567, ZNF679, ZNF813, ZNF92"
M16.30,A8,Complement,"ALG1, ALS2CR4, APOBEC3H, BPNT1, C1QB, C2, C20ORF127, CAV1, CCNE1, CLDN23, CPSF6, CTLA4, CTLA4, CXORF21, EDARADD, EID1, EZH2, GALK2, GCH1, GPR82, HNRNPA1, HS.270778, HS.551847, HS.554445, HSD17B7P2, ICA1, IL15, ITIH4, LOC401845, LOC642732, LOC646817, LOC647460, LOC648366, LOC650274, LOC652102, LOC652113, LOC652126, LOC654174, MCAT, MCM8, MTE, MTHFD1, NME1, NOLA1, NQO1, PDCD1, PGAM5, PRR11, PSEN2, PXMP4, RFC3, RGPD2, RNF34, SGOL2, STOML1, TEP1, TIMD4, TRIM14, TRIM5, TRIM69, UBA2, ZBTB32"
M16.31,A6,TBD,"ANKRD32, ARHGAP24, BCL2, BTBD15, C10ORF119, C10ORF73, C17ORF85, C1ORF160, C7ORF24, CSDE1, CSTF2T, DCPS, DNAJB12, DTX1, EED, ELAC2, EWSR1, EXT2, FLJ14154, FST, HDAC7A, HEATR6, HIAT1, HPS5, HS.4988, IL21R, KDELC2, KIAA0859, LIN7C, LMAN2L, LMNB2, LOC643452, LOC653171, LRRC41, LRRC58, MAP2K5, MESDC1, MRPL35, MRTO4, MTRF1, NASP, P2RY11, PAK1IP1, PLAG1, PLCL2, PWWP2A, RACGAP1, SARS2, SLC5A6, SRGAP2, STRBP, SYAP1, TBC1D13, TMEM57, TMEM97, TNFRSF13C, TRAP1, UBE1DC1, VPS33A, ZFP3, ZNF331, ZWILCH"
M16.32,A26,TBD,"ACTB, APIP, ARPC2, ASF1A, ATG4A, BCL7B, C11ORF17, C9ORF6, CCDC28B, CDCA8, CENPA, COX7C, DAZAP2, DCI, DMN, ETNK1, EZH2, FABP5, FAM127B, FAM33A, GTF3A, HELLS, HJURP, HS.372654, HS.535392, IKZF5, KLHDC2, KPNA4, LDHA, LOC387934, LOC648868, LRRC57, MEIS3P1, MGC70857, MRCL3, NUP37, OTUD1, PSMB10, RDBP, RPS6KB2, RTN4, SC5DL, SLC25A11, SLC30A1, SLC35A5, SLC39A8, SNAPIN, SPSB2, TADA1L, TBCA, TCEB2, TIMM17B, TMEM33, TMEM9B, UBE2E3, UBE2T, VKORC1L1, ZDHHC13, ZMPSTE24"
M16.33,A15,TBD,"ANKRD36, ASL, C21ORF66, DHX57, DNMT3A, EIF2C3, ETV3, FAM91A2, FLJ11292, GPR125, HEATR3, HIP1R, HM13, HS.131041, HS.191464, HS.201113, HS.225887, HS.357539, HS.384605, HS.445274, HS.464414, HS.539623, HS.544679, HS.550111, HS.551340, HS.561190, HS.62645, HTRA4, KIF27, LOC388397, LOC440456, LOC641705, LOC642109, LOC642393, LOC643831, LOC644144, LOC644297, LOC647606, LOC649639, LOC653197, LOC653352, LOC653468, LOC653800, LOC653980, LOC727948, LOC729008, LRRC37A, MAX, MRFAP1L1, PLGLA, PMS2CL, PMS2L2, POGZ, PRDM1, RNF19A, UCP3, ZNF326, ZNF563, ZNF565"
M16.34,A36,Gene transcription,"ABCC13, AKAP9, AKT1S1, ANK1, ANKRD9, BPGM, C17ORF76, C19ORF45, C6ORF106, CTSE, DENND1A, DIP2A, DYRK3, DYRK3, FAM13A1, FLCN, FLJ25371, GJC2, GNA12, GYPA, HBE1, HIST3H2BB, HS.107801, HS.390407, HS.568705, KANK2, KIAA1804, LIMS1, LOC388931, LOC388931, LOC400174, LOC401002, LOC440456, LOC641972, MAOA, MCART1, MGC13057, MGC33894, MSI2, MYL4, PAGE2, PIP5K1B, RHCE, RN7SK, SEC14L4, SGOL1, SLC14A1, SLC6A10P, SNX15, SOX6, ST6GALNAC4, SUZ12P, SYF2, TGM2, TP53BP2, TRIM10, TRIM10, TSPAN7, USP12"
M16.35,A15,TBD,"ADAM17, AFMID, AMFR, ANKRD36, ATP2B4, BANP, C19ORF6, COG5, CSNK1A1, CSNK1G2, CTDSP1, DNA2, EDNRB, GABBR1, GRIPAP1, GSDM1, HS.207604, HS.28170, HS.516420, HS.570636, HS.575085, HS.581234, KIAA1666, KRT9, LOC441763, LOC644739, LOC646508, LYZ, MACF1, MED15, MEF2A, MLL3, MTMR2, NBPF1, NBPF20, NOL10, PPID, PSMA1, RIPK5, RNF13, SLC23A1, SLC2A11, SLC6A13, SLC9A4, SMPD1, SNORD33, SNX6, TAF1, TEAD2, TES, TMEM159, TMEM34, TMLHE, USF1, ZDHHC13"
M16.36,A5,Gene transcription,"ADH5, AK5, ALDH6A1, ARSK, B3GNT6, BCKDHB, C2ORF15, CAMSAP1L1, CD302, CHEK2, CNN3, DJ222E13.2, DNAJC10, DPYSL4, DYNC2LI1, EBAG9, ELL3, FBLN7, FKBP3, GLT8D1, HS.449276, HS.511717, HSF5, KANK1, KIAA1324L, LIMS2, LIN7B, LOC440145, LOC550112, LOC730273, LRRC56, MMP28, NOG, NRCAM, OGG1, OPA3, PPHLN1, PRKDC, PTPRK, RAB30, RMND1, RTN4, SNORD32A, SNORD36C, SNX25, SSPN, TAF4B, TMEM107, XRN2, ZFP14, ZNF184, ZNF485, ZNF551, ZNF566"
